question_id,question,answer,image_id
quest2907,what is on the table,telephone,image39
quest2908,the chairs are surrounding which object,table,image39
quest2909,how many plug sockets are visible,4,image39
quest2910,what is the largest object,blinds,image40
quest2911,what is the largest object on the round table,tissue_roll,image40
quest2912,how many cables are there,3,image40
quest2913,what is on the left side of the green screen,chair,image41
quest2914,how many chairs are there,3,image41
quest2915,what are the colours identifiable on the whiteboard,"blue, black, green",image42
quest2916,how many bottle of liquid is visible,1,image42
quest2917,what are the colours of the cables running,"black, white",image42
quest2918,how many people are there in the framed picture,3,image43
quest2919,what is left side of the sofa,table,image43
quest2920,what is biggest black object,sofa,image43
quest2921,how many doors does the cupboard have,2,image44
quest2922,what is the colour of the hair brush,pink,image44
quest2923,what is right side of the tap,bottle_of_liquid,image44
quest2924,how many framed pictures are there,2,image44
quest2925,what is in between the toilet and cupboard,bottle_of_liquid,image45
quest2926,what are the colours in the carpet,"yellow, blue",image45
quest2927,how many tooth brush are there,2,image45
quest2928,what is on the red pouch,makeup_brush,image45
quest2929,what is right side of the tap,cup,image46
quest2930,what is on the left side of the wash basin,bottle_of_liquid,image46
quest2931,what is right side of the cup,towel,image46
quest2932,what is behind the cup,bottle_of_soap,image46
quest2933,what is left side of the curtain,towel,image47
quest2934,what is in between the toilet and cupboard,tissue_roll,image47
quest2935,how many bottles are there,2,image48
quest2936,what is in between the tap and the shelf,bar_of_soap,image48
quest2937,what is the colour of the bath tub,white,image48
quest2938,how many tooth brushes are there,3,image49
quest2939,what is in front of the tooth brush cup,toothpaste,image49
quest2940,how many doors are there in the cupboard beneath the wash basin,2,image49
quest2941,how many lights are there,2,image50
quest2942,what is the smallest object on the sofa,book,image50
quest2943,what is the largest object that is hung on the wall,picture,image50
quest2944,what is behind the left most lamp,blinds,image50
quest2945,what are predominantly filled in the rack,books,image51
quest2946,how many sofas are there,2,image51
quest2947,how many pictures are there,4,image51
quest2948,how many books shelves are there,3,image52
quest2949,what is in between the candle sticks and lamp,banana,image52
quest2950,what is beneath the black table,"stool, stool",image52
quest2951,what is beneath the letter stand,garbage_bin,image53
quest2952,what is the object closest to the door,"shoe, wall_decoration",image53
quest2953,what is the colour of the floor,brown,image53
quest2954,how many large rectangle objects are there on the table,5,image54
quest2955,how many chairs surround the table,6,image54
quest2956,what is hung on the wall,"picture, picture",image54
quest2957,what is right side of the laptop,book,image54
quest2958,what is right side of the book,chair,image54
quest2959,what is the round gray object,excercise_ball,image55
quest2960,what is left side of the exercise ball,lamp,image55
quest2961,what is left side of the bed,night_stand,image56
quest2962,what is on the night stand,tissue_box,image56
quest2963,what is right side of the bed,blinds,image56
quest2964,how many doors does the night stand have,3,image56
quest2965,what are the electronic gadgets in the picture,"laptop, printer",image57
quest2966,what is in front of the laptop,bottle_of_perfume,image57
quest2967,what is on the right side of the plug point,canister,image57
quest2968,what is on the wall,picture,image58
quest2969,what is the largest object,bed,image58
quest2970,how many pillows are there,2,image58
quest2971,what is the colour of the comforter,green,image58
quest2972,what is hung on the wall,basketball_hoop,image59
quest2973,what is infornt of the wall,"bin, table, chair",image59
quest2974,what is on the left side of the door on the floor,headphones,image59
quest2975,what is left side of the headphones,tissue_roll,image59
quest2976,what is on the ride side of the door,shirts_in_hanger,image59
quest2977,how many pairs of shoes are there around the bed,2,image60
quest2978,what is on the wall,window,image60
quest2979,what is in front of the blue bag on the bed,hair_brush,image60
quest2980,what is on the right side of the garbage bin,bed,image61
quest2981,what is on the left had side in front of the curtain,shirts_in_hanger,image61
quest2982,what is in between the cardboard box and the red poster,shoe,image61
quest2983,what is the colour of the curtain,green,image61
quest2984,which is the largest object,door,image62
quest2985,what is in front of the television monitor,"bottle_of_liquid, dvd_player",image62
quest2986,what is on the left side of the bottle of liquid,shaver,image62
quest2987,how many draws are there in the unit where the tv dvd is kept,2,image62
quest2988,what is on the door,jacket,image62
quest2989,what is in between the tv unit and the rack,cables,image63
quest2990,what is predominantly filled on the top most shelf of the left side stand,books,image63
quest2991,how many plastic cups of coffee are visible,1,image63
quest2992,what is beneath the keyboard,clothes,image63
quest2993,what is on the right side of the night stand,mirror,image64
quest2994,what are the things on the night stand,"bottle_of_perfume, papers",image64
quest2995,how many pillows are there on the bed,1,image64
quest2996,what is in front of the pillow,comforter,image64
quest2997,what are the colours visible,"white, brown",image65
quest2998,what is behind the bed,wall,image65
quest2999,what is at the right most edge of the table,lamp,image66
quest3000,what is on the left most edge of the table,bottle_of_liquid,image66
quest3001,what is on the left side of the book,perfume,image66
quest3002,what is in front of the lamp on the table,paper,image66
quest3003,how many photo frames are there,2,image66
quest3004,what is on the left side of the cream,lint_roller,image67
quest3005,what is the colour of the teddy bear,brown,image67
quest3006,what is above the television,dvd_player,image68
quest3007,how many drawer knobs are there beneath the television,8,image68
quest3008,what is beneath the yellow paper on the bookshelf,box,image69
quest3009,what is in front of the bookshelf,cloth_bag,image69
quest3010,what is the colour of the cloth bag,pink,image69
quest3011,what is on predominantly lying down on the bed,clothes,image70
quest3012,what is on the left side of the bed,night_stand,image70
quest3013,where are the flowers kept,vase,image70
quest3014,what is on the pillow,bag,image71
quest3015,how many pillows are there,2,image71
quest3016,what are the white objects are there on the bed,"comforter, pillow",image71
quest3017,what is in between the bed and night stand,"bottle_of_liquid, cables",image71
quest3018,how many slippers are there,3,image72
quest3019,what is in the shelf beneath the shelf of slippers,gift_wrapping_roll,image72
quest3020,what is hung on the left most side of the rack,jacket,image72
quest3021,what is on the right side of the rack,door,image72
quest3022,how many pictures are there on the wall,3,image73
quest3023,what is on the right side of the bottle of liquid,lamp,image73
quest3024,what is in front of the lamp,fan,image73
quest3025,what is on the night stand closer to the bed,books,image73
quest3026,what is on the bed,"comforter, pillow",image73
quest3027,what is behind the bed,curtain,image74
quest3028,what are the colours visible,"red, white, pink, gray",image74
quest3029,how many drawers are there,9,image75
quest3030,what is on the right side of the table,curtain,image75
quest3031,how many drawer knobs are there,11,image75
quest3032,what is on the left side of the bed,night_stand,image76
quest3033,what is on the night stand,"alarm_clock, lamp",image76
quest3034,what is on the wall,picture,image76
quest3035,what is on the right side of the lamp on the table,bottle_of_liquid,image76
quest3036,what is beneath the blinds,air_conditioner,image77
quest3037,what is the biggest black object on the table,fan,image77
quest3038,what is in between the air conditioner and the rack,cables,image77
quest3039,what is the colour of the blinds,brown,image77
quest3040,what is the largest object,bicycle,image78
quest3041,how many pictures are visible on the wall,4,image78
quest3042,what are the most predominant colours,"black, white",image78
quest3043,what is on the night stand,"laptop, clothes",image79
quest3044,what is the colour of the cloth on the comforter,"blue, gray",image79
quest3045,how many drawers are there in the table that holds the laptop,2,image79
quest3046,how many pillows are there,4,image79
quest3047,what is beneath the curtains,air_conditioner,image80
quest3048,what is hing on the rack,hat,image80
quest3049,what is in between the air conditioner and the rack,hockey_stick,image80
quest3050,what is in the third shelf of the rack,books,image80
quest3051,what is on the right side of the bed,night_stand,image81
quest3052,what is on the left most side on night stand,lamp,image81
quest3053,what is on the right side of the lamp,alarm_clock,image81
quest3054,what is the largest object,bed,image81
quest3055,what is in front of the pillow,clothes,image81
quest3056,what is the red object,deoderant,image82
quest3057,what is the black object in between the table and the bed,suitcase,image82
quest3058,what is in front of the laptop,mouse,image83
quest3059,what is on the left most side on the table,books,image83
quest3060,what is on the right side of the books,calculator,image83
quest3061,what is on the left side of the laptop,papers,image83
quest3062,what are filled on the tables,books,image84
quest3063,how many legs of the tables are visible,6,image84
quest3064,what is the colour of the wall decoration above the books rack,purple,image84
quest3065,what is on the left side of the wall ornaments,picture,image84
quest3066,how many columns of the rack are visible,4,image85
quest3067,what is filled in the rack,3,image85
quest3068,what is leaning against the left rack,ladder,image86
quest3069,how many books are displayed in the black rack,6,image87
quest3070,what are the colours that are predominant,"brown, red, black",image87
quest3071,what is on the ceiling,"pipe, light",image88
quest3072,what are the numbers drawn on the wall,"4, 6",image88
quest3073,what is hung on the wall,clock,image88
quest3074,what is on the right side of the pillar,table,image89
quest3075,what is on the black rack,dvds,image90
quest3076,what is the colour of the wall on the right side of the black stand,purple,image90
quest3077,what is in front of the stand with the bags,books,image91
quest3078,what is above the bag stand,clothes,image91
quest3079,what are the colours of the clothes in the left side,"white, blue",image92
quest3080,what is above the whit clothes,hat,image92
quest3081,what is hung from the ceiling on the right side of the pillar,light,image92
quest3082,what is the red object in front of the wall,lamp,image93
quest3083,what is on the right side of the lamp,monitor,image93
quest3084,what is on the right side of the monitor,telephone,image93
quest3085,what is on the wall above the clothes,clock,image93
quest3086,what is in front of the table,books,image93
quest3087,what is beneath the hat,clothes,image94
quest3088,what is on the left most side,shelves,image94
quest3089,what is the colour of the hat,"black, white",image94
quest3090,what is on the left side of the image95 behind the clothes,candle,image95
quest3091,how many steps are there,3,image95
quest3092,what are the colours of the clothes seen,"white, blue, black, gray",image95
quest3093,how many clothes stand are there in the front,4,image95
quest3094,how many stands are there in front of the pillar,2,image96
quest3095,what are there in the shelves in front of the pillar,decorative_item,image96
quest3096,what are dominantly filled in the shelves,cup,image97
quest3097,what are the colours of the cups,"blue, purple, black, white",image97
quest3098,how many shelves are visible,4,image97
quest3099,how many shelves are there in the rack which is in front,3,image98
quest3100,what is behind the cup stand,table,image98
quest3101,what is on the left side table,stool,image98
quest3102,what are the colours of the clothes,"pink, black, white, blue",image99
quest3103,what is on the right side of the photo stand,"cup, stand",image100
quest3104,what is on the left side of the photo stand,clothes,image100
quest3105,what is in front of the black cups,book,image101
quest3106,how many stands of cup are there,2,image101
quest3107,how many shelves are there in the right stand,3,image101
quest3108,what are the colours of the cups,"blue, black, white",image101
quest3109,what is on the right side rack,bottle,image102
quest3110,what is on the left side rack,cup,image102
quest3111,how many doors do the cupboards have,6,image102
quest3112,what is the colour of bottles in the last shelf,"blue, white, black",image102
quest3113,what is in the rack,picture,image103
quest3114,how many doors are there in the cupboard beneath the picture rack,2,image103
quest3115,what is on the racks,books,image104
quest3116,what is in front of the left rack,stand,image104
quest3117,how many stools are there,2,image105
quest3118,how many racks are visible,4,image105
quest3119,what are the colours of the stool,"black, gray",image105
quest3120,how many cartons are there,4,image106
quest3121,how many cartons have a sticker on them,3,image106
quest3122,how many shelves are there in the rack,7,image106
quest3123,how many pillars are visible,4,image107
quest3124,what is surrounding the pillar,table,image107
quest3125,what is on the ceiling,pipe,image107
quest3126,how many doors of the cupboard are open,1,image108
quest3127,what is next to the black paper holders in the left side,tape,image108
quest3128,what is kept below the shelf that has the tape,books,image108
quest3129,how many machines are there,3,image109
quest3130,what is in front of the pillar,"bin, books",image109
quest3131,how many lights are visible,4,image109
quest3132,what is in front of the cupboard,stand,image110
quest3133,what is above the cupboards,books,image110
quest3134,what is the colour of the equipment on the pillar,red,image110
quest3135,how many monitors are there,3,image111
quest3136,how many rows of shelves are there beneath the gray table,books,image111
quest3137,how many pillars are visible,2,image111
quest3138,what is the colour of the pillars,white,image112
quest3139,what is behind the monitor that is in the centre,carton,image112
quest3140,what is in front of the gray rack,garbage_bin,image112
quest3141,what is the colour of the monitors,black,image112
quest3142,what is the colour of the paper that is stuck on the left most side of the wall,black,image113
quest3143,how many lights are hanging from the ceiling on the left most side,3,image114
quest3144,what is on the first monitor on the left side,toy_doll,image114
quest3145,what is in the shelves beneath the table,doll,image114
quest3146,what is on the left side of the white clothes,bag,image115
quest3147,how many red objects are there,1,image115
quest3148,what are the colours of the clothes,"white, blue, black, pink, green",image115
quest3149,what is the colour of the clothes in the last shelf,"red, blue, green",image116
quest3150,how many colours of clothes are there,7,image116
quest3151,what is in front of the wall,table,image116
quest3152,around which object are the chairs placed,table,image117
quest3153,what is the colour of the walls,"white, green",image117
quest3154,what is directly opposite to the tables and chairs,bookshelf,image117
quest3155,how many tables are there,3,image118
quest3156,what is the colour of the poster in the right side,purple,image118
quest3157,what is the tallest object,stand,image119
quest3158,what is the colour of the stand,black,image119
quest3159,what is behind the chair,clothes,image119
quest3160,what is on the right side of the table,jacket,image120
quest3161,what is on the left most side of the whiteboard,plant,image120
quest3162,what are the colours of markers used on the white board,"red, green, black",image120
quest3163,what is in front of the desk,chair,image369
quest3164,how many drawers are visible,3,image369
quest3165,how many picture frames are there,2,image369
quest3166,what is on the right side of the table,window,image369
quest3167,what is on the table left side of the window,printer,image369
quest3168,what is on the wall,framed_certificate,image370
quest3169,what is beneath the desk,garbage_bin,image370
quest3170,how many drawers are there on the left side shelf,3,image370
quest3171,what is on the right side of the framed picture,paper_holder,image371
quest3172,what is behind the framed picture,papers,image371
quest3173,what is on the window,blinds,image371
quest3174,what is on the sofa,"pillow, books",image372
quest3175,what is on the left side of the sofa,table,image372
quest3176,what is on the table,"books, paper",image372
quest3177,what is on the right side of the sofa,window,image372
quest3178,how any chairs are there,3,image373
quest3179,what is on the right side of the chair on the table,laptop,image373
quest3180,what is on the table predominantly,papers,image373
quest3181,what is on the left side of the papers on the table,tissue_box,image373
quest3182,what is the colour of the wall,red,image374
quest3183,what is on the wall,picture,image374
quest3184,what is beneath the pictures,sofa,image374
quest3185,what is on the window,blinds,image375
quest3186,what is the colour of the book on the table,red,image375
quest3187,how many pillows are there on the sofa,2,image375
quest3188,what are the colours of the books in the shelf,"black, red, white",image375
quest3189,what is behind the tissue box,papers,image376
quest3190,what is beneath the laptop table,garbage_bin,image376
quest3191,what is the colour of the tables,black,image376
quest3192,what is on the left side of the books,monitor,image377
quest3193,what is beneath the monitor,dvd_player,image377
quest3194,how many books are open above the monitor,1,image377
quest3195,what is on the table,"paper, book",image378
quest3196,what is on the right side of the cartons,bookshelf,image378
quest3197,what is behind the chair,table,image378
quest3198,what is on the left side of the table,laptop,image378
quest3199,what is behind the laptop,ornamental_plant,image378
quest3200,what is in between the chairs,table,image379
quest3201,what is the biggest object on the table,lamp,image379
quest3202,what is on the left side of the lamp,cordless_phone,image379
quest3203,what is on the chair,pillow,image379
quest3204,what is on the arm rest of the chair,remote_control,image379
quest3205,what is on the left side of the table,sofa,image380
quest3206,what is on the left most side on the table,tissue_box,image380
quest3207,what is behind the tissue box,box,image380
quest3208,what is on the wall,light,image380
quest3209,what is the biggest object on the table,book,image380
quest3210,how many drawers are there,10,image381
quest3211,what is on the wall,light,image381
quest3212,what is on the table,"picture, books, papers, decorative_item",image381
quest3213,what is on the right side of the lamp,bookshelf,image381
quest3214,how many chairs are visible,4,image381
quest3215,what is behind the chair,curtain,image382
quest3216,how many drawers are there,6,image382
quest3217,what is in the last shelf on the right side of the lamp,cup,image382
quest3218,what is on the left side of the light,bookshelf,image383
quest3219,what is on the right side of the coffee table,chair,image383
quest3220,how many picture frames are there on the table,3,image383
quest3221,what is in front of the table,chair,image383
quest3222,how many brown coloured books are there on the table,3,image384
quest3223,what is behind the table,chair,image384
quest3224,what is on the left side of the bookshelf,picture,image384
quest3225,what is on the right side of the chair,table,image385
quest3226,what is on the table,book,image385
quest3227,what is the colour dominating,brown,image385
quest3228,what is behind the sofa,blinds,image386
quest3229,what is the colour of the sofa,black,image386
quest3230,how many drawers are there,2,image387
quest3231,how many monitors are there on the table,3,image387
quest3232,what is in front of the table,bag,image387
quest3233,what is above the monitors,bookshelf,image387
quest3234,what is on the left side of first monitor,papers,image387
quest3235,how many chairs are visible,2,image387
quest3236,what is on the left side of the bag,carton,image388
quest3237,what is behind the monitor,picture,image388
quest3238,what is suspended from the ceiling,light,image388
quest3239,what is behind the bag,desk,image388
quest3240,what is on the left side of the framed certificate,printer,image389
quest3241,what is on the right side of the chair on the floor,cable_box,image389
quest3242,what is in between the monitor and printer,"papers, books",image389
quest3243,how many pictures are there on the table,2,image389
quest3244,what is in front of the black monitor,keyboard,image389
quest3245,what is on the right side of the books,bag,image390
quest3246,what is beneath the bag,file,image390
quest3247,what is on the right side of the picture,pen_cup,image390
quest3248,what is on the right side of the switch board,window,image390
quest3249,what is on the left side of the door,toy_doll,image391
quest3250,what is beneath the toy doll,bag,image391
quest3251,what is on the wall,"framed_certificate, picture",image391
quest3252,what is on the table,"paper, tissue_box",image391
quest3253,what is in front of the wall,chair,image391
quest3254,what is on the chair,clothes,image391
quest3255,what is on the left side of the books,remote_control,image392
quest3256,what is on right side of the papers,business_cards,image392
quest3257,what is on the left side of the papers that is on the left side of the business card,tissue_box,image392
quest3258,what is in front of the chair,bag,image393
quest3259,what is on the left side of the chair,table,image393
quest3260,what is immediately on the left side of the chair,laptop,image393
quest3261,what is on the left side of the laptop,printer,image393
quest3262,what is behind the wooden stool,carton,image393
quest3263,how many switch boards are there,2,image394
quest3264,what is in front of the chair,bag,image394
quest3265,what is the colour of the bag on the left side of the papers,blue,image394
quest3266,what is on the left most side on the table,printer,image394
quest3267,how many people are there,2,image395
quest3268,what is on the right side of the woman,printer,image395
quest3269,what is on the right side of the printer,bottle_of_liquid,image395
quest3270,what is on the right side of the monitor,telephone,image395
quest3271,what is on the papers,cable_box,image396
quest3272,what is in front of the purple chair,carton,image396
quest3273,how many pictures are there on the wall,4,image396
quest3274,what is behind the purple chair,blinds,image396
quest3275,what is on the left side of the purple chair,door,image397
quest3276,what is on the pruple chair,paper,image397
quest3277,what is in front of the blinds,crib,image398
quest3278,what is on the left side of the crib,carton,image398
quest3279,what is on the right side of the crib,comforter,image398
quest3280,what is on the left side of the comforter,lamp,image398
quest3281,what is on the left side of the chair,stroller,image398
quest3282,how many blinds are there,2,image398
quest3283,what is the colour of the bag on the chair,pink,image399
quest3284,what is on the left side of the pink bag,toy_doll,image399
quest3285,what is behind the cartons,doll_house,image399
quest3286,what is on the cartons,"book, bag",image400
quest3287,what is on the carton in front of the doll house,toy,image400
quest3288,what is the colour of the carton on the right side of the chair,blue,image401
quest3289,what in between the blinds,jacket,image401
quest3290,what is on the chair,toy,image401
quest3291,what is in the crib,sheets,image401
quest3292,what is the colour of the kid sofa in front of the table,purple,image402
quest3293,what is on the right side of the kid sofa,toy_chair,image402
quest3294,what is on the left side of the purple sofa,crib,image402
quest3295,what is on the right side of the comforter,chart_roll,image402
quest3296,what is in between the chairs,table,image403
quest3297,what is the colour of the chairs,red,image403
quest3298,what is in front of the chair,stool,image404
quest3299,what is on the right side of the chair,ornamental_plant,image404
quest3300,what is on the wall,picture,image404
quest3301,how many drawers are there,3,image405
quest3302,what is on the table,clothes,image405
quest3303,what is on the floor,bottle_of_liquid,image405
quest3304,what is on the right side of the table,washing_machine,image405
quest3305,what is in front of the washing machine,laundry_basket,image405
quest3306,how many knobs are visible,3,image406
quest3307,what is on the drying machine,bottle_of_liquid,image406
quest3308,what is the colour of the laundry basket,blue,image406
quest3309,what is the colour of the clothes on the table,"green, blue, red",image406
quest3310,what is behind the drying stand,window,image407
quest3311,what is on the right side of the laundry basket,stand,image407
quest3312,what is on the stand,clothes,image407
quest3313,what is on the right side of the sink,microwave,image408
quest3314,what is behind the tap,bottle_of_liquid,image408
quest3315,what is beneath the table,garbage_bin,image408
quest3316,what is on the left side of the table,stool,image408
