question_id,question,answer,image_id
quest9002,how many drawer knobs are there,7,image682
quest9003,how many faucet handles are there,2,image682
quest9004,what is the colour of the object on the left side of the sink,red,image682
quest9005,what are the objects stuck on the wall which is on the left side of sink,"photo, light_switch",image682
quest9006,what is the object on the left corner of the sink top,vase,image682
quest9007,how many vases are there to the right side of the floor mat,3,image683
quest9008,what is found behind the floor mat,bathtub,image683
quest9009,how many towels are there,1,image684
quest9010,how many faucet handles are there,1,image684
quest9011,what is the object found at the right side of the sink,toothbrush,image684
quest9012,what is the object found at the right side of the sink,bottle_of_hand_wash_liquid,image684
quest9013,what is stuck on the door of the wall,roll_of_toilet_paper,image684
quest9014,what is stuck on the wall,roll_of_toilet_paper,image685
quest9015,what is the object found on the top of the toilet tank of cistern,tissue_box,image685
quest9016,how many shower knobs are found,4,image686
quest9017,what are found on the bottom left of the outside of the shower room,drawer,image686
quest9018,how many drawers are there,3,image686
quest9019,what is the colour of the floor mat,red,image686
quest9020,how many drawer handles are there,10,image687
quest9021,how many shower knobs are found,3,image687
quest9022,how many bottles with yellow cap are there,4,image687
quest9023,how many mirrors are there,2,image687
quest9024,what is the shower room door made up of,glass,image687
quest9025,what is the colour of the floor mat,red,image687
quest9026,how many drawer knobs are there,6,image688
quest9027,what is the colour of the drawer knobs,black,image688
quest9028,how many towels are there,3,image688
quest9029,how many towels are hanged on the towel rod,2,image688
quest9030,what is the colour of the left towel,black,image688
quest9031,how many faucet handles are there,1,image688
quest9032,how many brushes are there,1,image688
quest9033,what is the colour of the knobs,black,image689
quest9034,what is stuck on the wall,roll_of_toilet_paper,image689
quest9035,what are the objects found on the top of the toilet tank of cistern,books,image689
quest9036,how many books are on the top of the toilet tank of cistern,3,image689
quest9037,how many knobs are there,2,image689
quest9038,what is the towel colour,pink,image690
quest9039,what is found to the opposite side of the towel rod,bathtub,image690
quest9040,what is found to the left side of the towel rod,door,image690
quest9041,how many towels are there,1,image690
quest9042,what is the colour of the knob of the top drawer,green,image691
quest9043,what is the colour of the knob of the bottom drawer,pink,image691
quest9044,what are the objects found near the sink,"toothbrush, bottle_of_hand_wash_liquid, hand_sanitizer, cream",image691
quest9045,how many towels are seen in the mirror,pink,image691
quest9046,how many faucet handles are there,2,image691
quest9047,what are the objects found on the bathtub,"container_of_skin_cream, cream_tube, face_wash_cream",image692
quest9048,what are the colours found on the curtain,"red, green, blue, purple, orange",image692
quest9049,how many objects on the side of the wall,5,image692
quest9050,how many objects on the corner of the bathtub,3,image692
quest9051,how many towels are hanged,3,image693
quest9052,what is the object at the top of the towel rod,window,image693
quest9053,what is the object at the left side of the towel rod,curtain,image693
quest9054,what is the object at the bottom of the curtain,floor_mat,image693
quest9055,what is the object at the left side of the sink,towel,image693
quest9056,how many towels are there,3,image694
quest9057,how many towels are hanged under window,2,image694
quest9058,how many tissue boxes are there on the toilet tank of cistern,2,image694
quest9059,what is the colour of the towel,white,image694
quest9060,how many drawers found on the right side,2,image695
quest9061,what is the colour of the sink top,white,image695
quest9062,how many handles are there,2,image695
quest9063,what is found behind the sink,mirror,image695
quest9064,how many drawer knobs are there,4,image695
quest9065,how many bathtub knobs are there,2,image696
quest9066,what is the colour of the body wash brush,pink,image696
quest9067,how many objects are there in the left corner of the bathtub,2,image696
quest9068,how many towel rods are there,1,image696
quest9069,how many drawer knobs are there,10,image697
quest9070,how many towels are hanged in towel rod,1,image697
quest9071,how many faucet handles are there,2,image697
quest9072,what are the objects on the sink,"toothpaste, comb, bottle_of_hand_wash_liquid, hand_sanitizer, bar_of_soap, towel",image697
quest9073,what is the colour of the bar of soap,orange,image697
quest9074,what is the colour of the towel on the sink,white,image697
quest9075,how many faucets are there near the bathtub,2,image698
quest9076,what is on the top of the bathtub,window,image698
quest9077,how many drawer knobs are there,3,image698
quest9078,what is the colour of the piece of clothes near the bathtub,blue,image698
quest9079,what is the object hanged on the right side,clothes,image699
quest9080,what is the object found under the clothes,garbage_bin,image699
quest9081,how many drawers are opened,1,image699
quest9082,how many windows are there,2,image699
quest9083,what is the object behind the clothes,towel,image699
quest9084,how many faucet handles are there,2,image700
quest9085,how many drawer handles are there,4,image700
quest9086,what is found on the left side of sink,storage_rack,image700
quest9087,what is the colour of wall,white,image701
quest9088,what is in the side of toilet,tissue_roll,image701
quest9089,what is to right of toilet,sink,image701
quest9090,what is on the sink,soap,image701
quest9091,what is to right of sink,window,image702
quest9092,what is above sink,mirror,image702
quest9093,what is to left of sink,door,image702
quest9094,what is in front of sink,toilet,image703
quest9095,what is right of toilet,tissue_roll,image703
quest9096,what is kept on the floor,garbage_bin,image703
quest9097,what is above toilet,tissue_roll,image704
quest9098,what is right of toilet,book_holder,image704
quest9099,what is the colour of towel,brown,image705
quest9100,what is above sink,mirror,image705
quest9101,what is above toilet,tissue_roll,image705
quest9102,what is the colour of napkin,white,image706
quest9103,what is left of bath tub,toilet,image706
quest9104,what is the colour of wall,brown,image707
quest9105,what is to left of sink,tissue_roll,image708
quest9106,what is behind the sink,mirror,image708
quest9107,what is to left of toilet,sink,image709
quest9108,what is in front of sink,towel,image709
quest9109,what is left of sink,tissue_roll,image710
quest9110,what is the colour of door,white,image711
quest9111,what is in the door,door_knob,image711
quest9112,what is behind the door,shelves,image711
quest9113,what is the largest object,shelves,image712
quest9114,what is to right of shelf,window,image712
quest9115,what is on the wall,mirror,image713
quest9116,what is on the floor,stand,image713
quest9117,what is on the stand,bottle,image713
quest9118,what colour is the wall,brown,image714
quest9119,what colour is the bath tub,white,image714
quest9120,what is right of door,shelves,image715
quest9121,what is placed in the shelf,towel,image715
quest9122,what is the colour of shelf,white,image715
quest9123,what is in front of sink,shelves,image716
quest9124,what is behind sink,mirror,image716
quest9125,what is left of sink,towel,image716
quest9126,what is colour of wall,white,image716
quest9127,what is to right of sink,napkin,image717
quest9128,what is behind the sink,tissue_roll,image717
quest9129,what is the colour of towel,yellow,image718
quest9130,what is in front of towel,toilet,image718
quest9131,what is the colour of wall,white,image719
quest9132,what is the colour of towel,blue,image719
quest9133,what is to left of sink,bottle,image720
quest9134,what is behind the sink,mirror,image720
quest9135,what is to right of sink,window,image720
quest9136,what is near the sink,glass,image721
quest9137,what is the colour of sink,white,image721
quest9138,what is in front of bathtub,toilet,image722
quest9139,what is in front of toilet,door,image722
quest9140,what is to left of toilet,towel,image723
quest9141,what is the colour of wall,white,image724
quest9142,what is to right of door,toilet,image724
quest9143,what is to left of door,sink,image724
quest9144,what is placed near the sink,hand_sanitizer,image724
quest9145,what is to left of sink,window,image725
quest9146,what is on the floor,garbage_bin,image725
quest9147,what is behind the sink,mirror,image725
quest9148,what is the colour of wall,white,image725
quest9149,what is the name of thing hang in top right side,shower_hose,image726
quest9150,what is the name of object in right bottom,bathtub,image726
quest9151,what is the colour of towel,white,image727
quest9152,how many partitions in wash basin table,7,image727
quest9153,what is the object display in mirror,person,image727
quest9154,what is the colour of the toilet basin,white,image728
quest9155,what kind of material used in wash basin top,stones,image728
quest9156,what is above of flusher,tissue_box,image728
quest9157,what is the colour of roll of tissue paper,white,image728
quest9158,how many knobs in wash basin cupboard,4,image729
quest9159,what is colour of the soap oil,orange,image729
quest9160,what is the object displayed in white colour of right bottom,floor_mat,image729
quest9161,how many towels on the wash basin,2,image731
quest9162,how many toothbrushes in toothbrush holder,4,image731
quest9163,how many bottles on wash basin,3,image731
quest9164,give any one of the toothbrush colour,pink,image731
quest9165,what is above the flusher,tissue_box,image732
quest9166,which background used in photo frame,white,image732
quest9167,how many towels hanged,2,image733
quest9168,how many borders on dark blue towel,2,image733
quest9169,what is behind of garbage bin,toilet_brush,image733
quest9170,how many switches on wall,2,image734
quest9171,how many screws on switch board,4,image734
quest9172,how many bottles are there,1,image734
quest9173,how many flower vases on the table,1,image735
quest9174,how many legs in the stool,4,image735
quest9175,what is next by the first towel,toothpaste,image735
quest9176,how many wash basins are there,2,image735
quest9177,how many objects on bathtub,4,image736
quest9178,how many plant vases are there,3,image736
quest9179,what is the colour of middle candle,orange,image736
quest9180,how many trays in plastic cupboard,5,image737
quest9181,what is the third tray handle colour,green,image737
quest9182,how many bottles on bathtub,3,image737
quest9183,what is the colour of the tissue roll,white,image738
quest9184,how many racks in shelves,5,image739
quest9185,what is the colour of towel,green,image739
quest9186,what is above on little wall,bottle,image739
quest9187,what is the colour of plug,black,image739
quest9188,what is the colour of screen,red,image740
quest9189,how many draw displayed,4,image740
quest9190,how many draw handle displayed,2,image741
quest9191,what is the colour of draw handle,black,image741
quest9192,how many blue bottles in basket,1,image741
quest9193,how many black rods in the mirror view,2,image741
quest9194,how many garbage bins are there,1,image742
quest9195,how many blades in window,6,image742
quest9196,what is the colour of garbage bin plastic cover,white,image742
quest9197,what is the colour of the screen,red,image742
quest9198,where is the towel hanged,towel_rod,image743
quest9199,how many bottles in mirror view,5,image743
quest9200,how many bottles are there,3,image744
quest9201,what is the cap colour of the second bottle,blue,image744
quest9202,what is liquid colour in third bottle,yellow,image744
quest9203,how many chairs are there,4,image745
quest9204,what is the handle colour of the first mug,yellow,image745
quest9205,how many mugs are there,7,image745
quest9206,what is the colour of chair,brown,image745
quest9207,how many cupboards are there,5,image746
quest9208,how many legs in each chair,4,image746
quest9209,how many bottles on wooden desk,1,image746
quest9210,what is the colour of chair cushions,white,image746
quest9211,how many yellow colour fruits are there,5,image747
quest9212,how many blue legs displayed,5,image747
quest9213,what is the colour of the can,white,image747
quest9214,what is the colour of the round table mat,white,image747
quest9215,how many chairs are there,6,image748
quest9216,how many windows are there,3,image748
quest9217,how many flower vases on window,4,image748
quest9218,what is the colour of the flower vase stand,black,image748
quest9219,what are the objects seen outside of the window,plant,image748
quest9220,how many down draws are there,9,image749
quest9221,how many cupboards are there,4,image749
quest9222,how many chairs in between draws,1,image749
quest9223,what is the screen colour of computer,white,image749
quest9224,how many variety fruits are there,6,image750
quest9225,how many apples are there,3,image750
quest9226,how many bananas are there,3,image750
quest9227,what is colour of the clothes on wash basin,orange,image750
quest9228,how many cupboards are there in the wall,3,image751
quest9229,what is the colour of juice maker,white,image751
quest9230,how many tea cups are there,2,image751
quest9231,what is the colour of the bowl,yellow,image751
quest9232,what is on the left side of the cupboards on the wall,microwave,image751
quest9233,what is on the left side of the tea cups,coffee_machine,image751
quest9234,how many carpets are there one the floor,2,image752
quest9235,what is the colour of the door,brown,image752
quest9236,by which the centre of the door is made,glass,image752
quest9237,how many microwave ovens are there,2,image752
quest9238,how many drawers you can see,6,image752
quest9239,how many photos found on the room,1,image753
quest9240,what is the colour of the water bottle,white,image753
quest9241,how many apples are there,2,image753
quest9242,how many knifes are there on the table,3,image753
quest9243,how many cupboards are there on the top,2,image753
quest9244,what is the cap colour of the water cup,pink,image753
quest9245,what is placed on the stove,tea_pot,image754
quest9246,what is the colour of the tea pot,white,image754
quest9247,what is the chair colour,brown,image754
quest9248,how many chairs are there,1,image754
quest9249,how many photographs are there,1,image754
quest9250,how many chair legs you can see,2,image754
quest9251,what is on the left side of the stove,knife_rack,image754
quest9252,how many handles can you see in stove,4,image755
quest9253,what is the colour of the tea pot,white,image755
quest9254,what is the colour of the door,brown,image755
quest9255,what is the middle part of the door made up of,glass,image755
quest9256,how many stools found,3,image756
quest9257,what is the colour of the stool,blue,image756
quest9258,what are found under the dinning table,stool,image756
quest9259,what are the fruit varieties are there,"banana, apple, orange",image756
quest9260,how many coffee machines are there,1,image756
quest9261,how many juicers are there,1,image756
quest9262,how many stools can you see,2,image757
quest9263,how many chairs can you see,3,image757
quest9264,what is the colour of the sofa,white,image757
quest9265,what is the colour of the table mat,white,image757
quest9266,what is the colour of the table mat,white,image758
quest9267,what is the colour of the bowl,white,image758
quest9268,how many plant pots are there,3,image758
quest9269,how many table mats are there,2,image758
quest9270,how many chairs are there,4,image758
quest9271,how many cupboards are there,5,image759
quest9272,how many gloves are there,2,image759
quest9273,what is the colour of the gloves,white,image759
quest9274,what is the colour of the cupboard,brown,image759
quest9275,how many knifes are there,3,image759
quest9276,how many drawers are there,2,image759
quest9277,what is at the bottom of the cupboard,knife_rack,image759
quest9278,what is the colour of the floor tile,white,image760
quest9279,how many chairs are there,2,image760
quest9280,how many chairs are there,4,image761
quest9281,what is the colour of the cushion,black,image761
quest9282,what is inside the cupboard,garbage_bin,image762
quest9283,how many lamps are seen,1,image762
quest9284,what is the colour of the garbage bin,white,image762
quest9285,how many cupboards chambers found below,3,image762
quest9286,what is the colour of the lamp,purple,image762
quest9287,how many cupboards can see,2,image763
quest9288,what is the colour of the handle of the refridgerator,black,image763
quest9289,how many shoe pairs are there,5,image763
quest9290,how many coloured shoe pairs are there,2,image763
quest9291,what are on the racks to the right side of the refridgerator,books,image763
quest9292,what are on the rack,books,image764
quest9293,what is to the right side of the cupboard,stove,image764
quest9294,what is the type of the stove,grill,image764
quest9295,what is found outside of the room,"tea_pot, sofa",image764
quest9296,how many wash basins are there,2,image765
quest9297,what is to the right side of the wash basin,"plant, bottle_of_hand_wash_liquid",image765
quest9298,how many handles on the cupboards,8,image765
quest9299,what is to the right side of the wash basin,"plant, bottle_of_hand_wash_liquid",image766
quest9300,what is on the hanger,towel,image766
quest9301,what is the colour of the towel,pink,image766
quest9302,what is at the bottom of the cupboard,knife,image766
quest9303,what is the colour of the knife rack,yellow,image766
quest9304,how many knifes are there,3,image766
quest9305,how many chairs are there,6,image767
quest9306,how many windows are there,2,image767
quest9307,how many cupboards to the right of the first window,3,image767
quest9308,what is in front of the second window,sink,image767
quest9309,how many empty racks are there,6,image767
quest9310,how many chairs can you see,2,image768
quest9311,what were stuck on the refridgerator,papers,image768
quest9312,what is the colour of the door,white,image768
quest9313,what is the colour of the fruit,green,image769
quest9314,what is on the stove burner,tea_pot,image769
quest9315,what is to the left side of the stove,microwave,image769
quest9316,what is the door colour,white,image769
quest9317,what is the handle colour of the refridgerator,black,image769
quest9318,how many burner knobs are there,4,image770
quest9319,what is the colour of the bowl,white,image770
quest9320,what is the left side of the stove,microwave,image770
quest9321,how many cupboards are there,3,image770
quest9322,what is the colour of the bowl,white,image771
quest9323,what are found near the wash basin,"bottle_of_hand_wash_liquid, towel, soap",image771
quest9324,how many cupboards found below,1,image771
quest9325,how many windows can you see,1,image771
quest9326,how many chairs found,4,image772
quest9327,what are on the table cloth,"newspapers, bowl",image772
quest9328,how many chairs can you see,3,image773
quest9329,what is kept on the table cloth,newspapers,image773
quest9330,what is the colour of the refridgerator,white,image773
quest9331,what is stuck on the refridgerator,"picture, papers",image773
quest9332,what is the colour of the refridgerator,white,image774
quest9333,what is to the left side of the basin,bottle_of_hand_wash_liquid,image775
quest9334,what is the colour of the bottle of hand wash liquid,green,image775
quest9335,how many cupboards at the top right of the basin,2,image775
quest9336,what is the colour of the refridgerator,white,image775
quest9337,what is stuck on the refridgerator,picture,image775
quest9338,what is on the plastic stand,bowl,image775
quest9339,how many burners are there,5,image776
quest9340,what is the colour of the liquid in hand wash,green,image776
quest9341,what is the colour of the box near the gas burner,white,image776
quest9342,how many switch boxes are there,2,image776
quest9343,how many cupboard doors displayed,10,image777
quest9344,which colour of border appeared in black cupboard,white,image777
quest9345,what is the name of round shape above the deck,plate,image778
quest9346,how many cupboard handle displayed,5,image778
quest9347,what is the colour display above the liquid bottle,pink,image778
quest9348,how many horizontal reapers in brown door,4,image778
quest9349,how many vertical handle in cupboard,3,image779
quest9350,what is the colour of burners,black,image779
quest9351,how many bananas are there,2,image779
quest9352,what is near by deck,refridgerator,image779
quest9353,how many colours fully displayed in doll,3,image780
quest9354,what is the colour of doll face,yellow,image780
quest9355,how many ovens are there,1,image780
quest9356,what is border colour of floor mat,brown,image780
quest9357,how many white bottles are there,1,image780
quest9358,what is the colour of bag,black,image781
quest9359,how many colours of cushion in chairs,2,image781
quest9360,what is the colour of revolving chair,black,image781
quest9361,what is above the table near by bag,paper,image781
quest9362,what is the colour of switch,white,image782
quest9363,how many silver baskets are there,2,image782
quest9364,how many legs in revolving chair,5,image782
quest9365,what is the colour of computer screen,black,image782
quest9366,how many chandeliers are there,1,image783
quest9367,what is the colour of liquid filled in bottle,green,image783
quest9368,how many switch boxes is there,3,image783
quest9369,what is the colour of rice cooker,white,image784
quest9370,how many legs displayed in dog,2,image784
quest9371,what is the animal found,dog,image784
quest9372,how many glass tumblers near by rice cooker,1,image784
quest9373,how many burners are there,4,image785
quest9374,how many colours of towels are there,5,image785
quest9375,what is the handle colour of vessel on burner,black,image785
quest9376,how many empty burners are there,3,image785
quest9377,how many scissors are there,1,image786
quest9378,how many green liquid bottles are there,1,image786
quest9379,what is the colour of green liquid bottle cap,white,image786
quest9380,how many photos mount in wall,2,image786
quest9381,how many bottles near by rice cooker,3,image787
quest9382,what is colour of middle bottle cap,orange,image787
quest9383,how many spray bottles is there,1,image787
quest9384,what is the colour of the clothes,black,image787
quest9385,how many top lights are there,3,image788
quest9386,what is the colour of cupboard,brown,image788
quest9387,what it the colour of cupboard border,black,image788
quest9388,what is the colour of flower vase leaf near by cupboard,green,image789
quest9389,how many top lights on,4,image789
quest9390,how many silver wash basins are there,2,image790
quest9391,how many cupboard handle are there,18,image790
quest9392,what is the colour of closed door,white,image790
quest9393,what is the colour of cupboard handle,black,image790
quest9394,what is the colour of the cupboard border,black,image791
quest9395,what is the handle colour of the cupboard,black,image791
quest9396,what is the colour of the oven,white,image791
quest9397,what is the colour of the door,white,image791
quest9398,how many cupboards are there,2,image792
quest9399,how many drawers are there,8,image792
quest9400,what are on the table,"paper, plastic_bowl, remote_control",image792
quest9401,how many windows are there,2,image792
quest9402,what is the colour of the cupboard handles,black,image792
quest9403,what is the colour of the oven,white,image793
quest9404,how many bananas are found,1,image793
quest9405,what is the border colour of the dinning table,red,image794
quest9406,how many chairs are there,5,image794
quest9407,what is the chair colour,blue,image794
quest9408,how many photos are on the wall,3,image794
quest9409,how many window splits are there,5,image794
quest9410,how many cupboard handle can see,7,image795
quest9411,what is the colour of the clothes,blue,image795
quest9412,how many drawers are there,2,image795
quest9413,how many cupboards are there,6,image796
quest9414,how many drawers are there,11,image796
quest9415,how many ceiling lights are there,1,image796
quest9416,how many chairs can you see,1,image796
quest9417,what is to the left of the chair,door,image796
quest9418,what is the colour of the refridgerator,black,image797
quest9419,what are the things stuck on the refridgerator,photo,image797
quest9420,how many chairs are there,2,image797
quest9421,what is behind the chair,door,image797
quest9422,what is the colour of the chair seat,white,image797
quest9423,what is stuck on the wall,photo,image797
quest9424,how many chairs are there,6,image798
quest9425,what is the colour of the chair arm,black,image798
quest9426,what is the colour of the chair seat,black,image798
quest9427,how many doors are there,2,image798
quest9428,what is the colour of the plant vase,black,image798
quest9429,what is on the ceiling,fan,image798
quest9430,what is dinning table made up of,glass,image798
quest9431,how many photo frames stuck on the wall,3,image798
quest9432,what is dinning table made up of,glass,image799
quest9433,how many chairs are there,3,image799
quest9434,how many ceiling lights are there,6,image799
quest9435,what is on the dinning table,plant_pot,image799
quest9436,what is on the left side,refridgerator,image799
quest9437,what is the colour of the refridgerator,black,image799
quest9438,what is under the cupboard,coffee_machine,image800
quest9439,how many plates are there,3,image800
quest9440,what is the colour of the coffee pot,white,image800
quest9441,how many glass cups are there,4,image800
quest9442,what is on the top of the table,pillow,image801
quest9443,what are the objects found near the table,chair,image801
